{
  "$schema": "https://buildy.tw/schema/registry-item.json",
  "name": "landing-page",
  "type": "registry:template",
  "description": "A complete landing page template with hero, features, and footer sections",
  "dependencies": [],
  "devDependencies": [],
  "files": [
    {
      "path": "utility/templates/landing-page.js",
      "content": "/**\r\n * A complete landing page template with hero, features, and footer sections\r\n */\r\nexport function LandingPageTemplate({ \r\n  heroTitle, \r\n  heroSubtitle, \r\n  features = [], \r\n  className = \"\" \r\n}) {\r\n  const featuresHtml = features.map(feature => `\r\n    <div class=\"p-6 border rounded-lg\">\r\n      <h3 class=\"text-xl font-semibold mb-2\">${feature.title}</h3>\r\n      <p class=\"text-muted-foreground\">${feature.description}</p>\r\n    </div>\r\n  `).join('')\r\n\r\n  return `\r\n    <div class=\"min-h-screen ${className}\">\r\n      <!-- Hero Section -->\r\n      <section class=\"relative py-20 px-4 text-center bg-gradient-to-b from-background to-muted\">\r\n        <div class=\"max-w-4xl mx-auto\">\r\n          <h1 class=\"text-4xl md:text-6xl font-bold mb-6\">${heroTitle}</h1>\r\n          <p class=\"text-xl text-muted-foreground mb-8\">${heroSubtitle}</p>\r\n          <div class=\"flex flex-col sm:flex-row gap-4 justify-center\">\r\n            <button class=\"px-6 py-3 bg-primary text-primary-foreground rounded-md font-medium\">\r\n              Get Started\r\n            </button>\r\n            <button class=\"px-6 py-3 border border-input rounded-md font-medium\">\r\n              Learn More\r\n            </button>\r\n          </div>\r\n        </div>\r\n      </section>\r\n\r\n      <!-- Features Section -->\r\n      <section class=\"py-20 px-4\">\r\n        <div class=\"max-w-6xl mx-auto\">\r\n          <h2 class=\"text-3xl font-bold text-center mb-12\">Features</h2>\r\n          <div class=\"grid grid-cols-1 md:grid-cols-3 gap-8\">\r\n            ${featuresHtml}\r\n          </div>\r\n        </div>\r\n      </section>\r\n\r\n      <!-- Footer -->\r\n      <footer class=\"py-12 px-4 border-t\">\r\n        <div class=\"max-w-6xl mx-auto text-center\">\r\n          <p class=\"text-muted-foreground\">Â© 2024 Your Company. All rights reserved.</p>\r\n        </div>\r\n      </footer>\r\n    </div>\r\n  `\r\n} ",
      "target": "templates"
    }
  ]
}