{
  "$schema": "https://buildy.tw/schema/registry-item.json",
  "name": "FeaturesGridMediaCards",
  "type": "registry:block",
  "description": "",
  "dependencies": [],
  "devDependencies": [],
  "files": [
    {
      "path": "builddy/blocks/features/FeaturesGridMediaCards.tsx",
      "content": "import { Badge } from \"@/components/ui/badge\";\r\n\r\ninterface FeaturesGridMediaCardsProps {\r\n  content: {\r\n    badge: string;\r\n    title: string;\r\n    description: string;\r\n    features: Array<{\r\n      id: string;\r\n      title: string;\r\n      description: string;\r\n    }>;\r\n  };\r\n}\r\n\r\nexport default function FeaturesGridMediaCards({ content }: FeaturesGridMediaCardsProps) {\r\n  const { badge, title, description, features } = content;\r\n  return (\r\n    <section className=\"w-full py-16 lg:py-32 bg-background\">\r\n      <div className=\"container mx-auto px-4 md:px-6 lg:px-8\">\r\n        <div className=\"flex flex-col gap-10\">\r\n          <div className=\"flex gap-4 flex-col items-start\">\r\n            <div>\r\n              <Badge variant=\"outline\" className=\"text-muted-foreground\">{badge}</Badge>\r\n            </div>\r\n            <div className=\"flex flex-col gap-2\">\r\n              <h2 className=\"text-3xl md:text-4xl lg:text-6xl font-bold max-w-xl text-foreground text-left\">\r\n                {title}\r\n              </h2>\r\n              <p className=\"text-lg text-muted-foreground max-w-2xl text-left\">\r\n                {description}\r\n              </p>\r\n            </div>\r\n          </div>\r\n          <div className=\"grid grid-cols-1 sm:grid-cols-2 lg:grid-cols-3 gap-8\">\r\n            {features?.map((feature) => (\r\n              <div key={feature.id} className=\"flex flex-col gap-2 bg-card border border-border hover:shadow-lg transition-all rounded-md p-6\">\r\n                <div className=\"bg-muted rounded-md aspect-video mb-2\"></div>\r\n                <h3 className=\"text-xl font-semibold text-card-foreground\">{feature.title}</h3>\r\n                <p className=\"text-muted-foreground text-base\">{feature.description}</p>\r\n              </div>\r\n            ))}\r\n          </div>\r\n        </div>\r\n      </div>\r\n    </section>\r\n  );\r\n}\r\n\r\nexport const featuresGridMediaCardsTemplate = {\r\n  id: \"featuresGridMediaCards\",\r\n  name: \"Features Grid Media Cards\",\r\n  description: \"A grid for displaying features with media cards\",\r\n  component: FeaturesGridMediaCards,\r\n  defaultContent: {\r\n    badge: \"Marketing & Design\",\r\n    title: \"Innovate Your Brand!\",\r\n    description: \"Crafting remarkable experiences in UI/UX for your business.\",\r\n    features: [\r\n      {\r\n        id: \"uiux1\",\r\n        title: \"User-Centric Design\",\r\n        description: \"Deliver intuitive and engaging interfaces that resonate with your target audience.\"\r\n      },\r\n      {\r\n        id: \"marketing1\",\r\n        title: \"Strategic Branding\",\r\n        description: \"Elevate your brand identity and ensure a consistent message across all platforms.\"\r\n      },\r\n      {\r\n        id: \"shadcn1\",\r\n        title: \"Shadcn Library Integration\",\r\n        description: \"Seamlessly blend components for a cohesive and modern design aesthetic.\"\r\n      }\r\n    ]\r\n  }\r\n};",
      "target": "blocks"
    }
  ]
}