{
  "$schema": "https://buildy.tw/schema/registry-item.json",
  "name": "BusinessCardsGallery",
  "type": "registry:block",
  "description": "",
  "dependencies": [
    "lucide-react"
  ],
  "devDependencies": [],
  "files": [
    {
      "path": "builddy/blocks/business/BusinessCardsGallery.tsx",
      "content": "import { Badge } from \"@/components/ui/badge\";\r\nimport { Bookmark, BookmarkCheck, Star, Shield, Zap, Users, Target, Heart } from \"lucide-react\";\r\n\r\nconst iconMap = {\r\n  Bookmark,\r\n  BookmarkCheck,\r\n  Star,\r\n  Shield,\r\n  Zap,\r\n  Users,\r\n  Target,\r\n  Heart,\r\n} as const;\r\n\r\ninterface BusinessCardsGalleryProps {\r\n  content: {\r\n    promo: string;\r\n    title: string;\r\n    description: string;\r\n    cards: Array<{\r\n      id: string;\r\n      title: string;\r\n      description: string;\r\n      icon: keyof typeof iconMap;\r\n      className: string;\r\n    }>;\r\n  };\r\n}\r\n\r\nexport default function BusinessCardsGallery({ content }: BusinessCardsGalleryProps) {\r\n  const { promo, title, description, cards } = content;\r\n  \r\n  return (\r\n    <section className=\"w-full py-16 lg:py-32 bg-background\">\r\n      <div className=\"container mx-auto px-4 md:px-6 lg:px-8\">\r\n        <div className=\"flex flex-col gap-8\">\r\n          <header className=\"flex flex-col gap-4 items-start\">\r\n            <Badge variant=\"outline\" className=\"rounded-full h-7\">\r\n              {promo}\r\n            </Badge>\r\n            <div className=\"flex flex-col gap-2\">\r\n              <h2 className=\"text-3xl md:text-4xl lg:text-6xl font-bold max-w-xl text-foreground\">\r\n                {title}\r\n              </h2>\r\n              <p className=\"text-lg text-muted-foreground max-w-2xl\">\r\n                {description}\r\n              </p>\r\n            </div>\r\n          </header>\r\n          <div className=\"grid grid-cols-1 sm:grid-cols-2 lg:grid-cols-3 xl:grid-cols-4 gap-8\">\r\n            {cards?.map((card) => {\r\n              const IconComponent = iconMap[card.icon];\r\n              return (\r\n                <div\r\n                  key={card.id}\r\n                  className={`bg-card rounded-md p-6 flex flex-col justify-between ${card.className} hover:shadow-lg transition-all duration-300 border border-border`}\r\n                >\r\n                  {IconComponent && <IconComponent className=\"h-8 w-8 text-primary mb-4\" />}\r\n                  <div className=\"flex flex-col\">\r\n                    <h3 className=\"text-xl font-semibold tracking-tight text-card-foreground\">\r\n                      {card.title}\r\n                    </h3>\r\n                    <p className=\"text-muted-foreground text-base max-w-xs\">\r\n                      {card.description}\r\n                    </p>\r\n                  </div>\r\n                </div>\r\n              );\r\n            })}\r\n          </div>\r\n        </div>\r\n      </div>\r\n    </section>\r\n  );\r\n}\r\n\r\nexport const businessCardsGalleryTemplate = {\r\n  id: \"businessCardsGallery\",\r\n  name: \"Business Cards Gallery\",\r\n  description: \"A gallery of business cards for showcasing features\",\r\n  component: BusinessCardsGallery,\r\n  defaultContent: {\r\n    promo: \"BuildY/UI Design\",\r\n    title: \"Inspiring Innovation in Marketing & Design\",\r\n    description: \"Craft intuitive and engaging interfaces with Buildy/UI. Streamline workflows and empower your brand with cutting-edge solutions.\",\r\n    cards: [\r\n      {\r\n        id: \"card1\",\r\n        title: \"Innovate Your Brand\",\r\n        description: \"Transform your brand with modern design principles that resonate with your audience.\",\r\n        icon: \"Bookmark\",\r\n        className: \"lg:col-span-2 lg:row-span-2 aspect-square lg:aspect-auto\"\r\n      },\r\n      {\r\n        id: \"card2\",\r\n        title: \"Bookmark-Centric Design\",\r\n        description: \"Deliver intuitive experiences that prioritize user needs and usability.\",\r\n        icon: \"BookmarkCheck\",\r\n        className: \"aspect-square\"\r\n      },\r\n      {\r\n        id: \"card3\",\r\n        title: \"Strategic Branding\",\r\n        description: \"Ensure consistency and elevate your brand identity across platforms.\",\r\n        icon: \"Target\",\r\n        className: \"aspect-square\"\r\n      },\r\n      {\r\n        id: \"card4\",\r\n        title: \"Seamless Aesthetics\",\r\n        description: \"Integrate cohesive, modern design components effortlessly.\",\r\n        icon: \"Star\",\r\n        className: \"aspect-square\"\r\n      },\r\n      {\r\n        id: \"card5\",\r\n        title: \"Security Foundation\",\r\n        description: \"Leverage secure and robust componentry for your applications.\",\r\n        icon: \"Shield\",\r\n        className: \"aspect-square\"\r\n      },\r\n      {\r\n        id: \"card6\",\r\n        title: \"Performance Boost\",\r\n        description: \"Achieve rapid development with optimized utility-first approach.\",\r\n        icon: \"Zap\",\r\n        className: \"aspect-square\"\r\n      },\r\n      {\r\n        id: \"card7\",\r\n        title: \"Team Collaboration\",\r\n        description: \"Experience flexible and responsive development with your team.\",\r\n        icon: \"Users\",\r\n        className: \"aspect-square\"\r\n      },\r\n      {\r\n        id: \"card8\",\r\n        title: \"Open Source Excellence\",\r\n        description: \"Access open source components for personal or commercial projects.\",\r\n        icon: \"Heart\",\r\n        className: \"lg:col-span-2 aspect-square lg:aspect-auto\"\r\n      }\r\n    ]\r\n  }\r\n};",
      "target": "blocks"
    }
  ]
}