{
  "$schema": "https://buildy.tw/schema/registry-item.json",
  "name": "DesignSystemWebinars",
  "type": "registry:block",
  "description": "",
  "dependencies": [
    "lucide-react"
  ],
  "devDependencies": [],
  "files": [
    {
      "path": "builddy/blocks/business/DesignSystemWebinars.tsx",
      "content": "import { ArrowRight } from \"lucide-react\";\r\n\r\ninterface DesignSystemWebinarsProps {\r\n  content: {\r\n    title: string;\r\n    webinars: Array<{\r\n      title: string;\r\n      summary: string;\r\n      label: string;\r\n      author: string;\r\n      published: string;\r\n      href: string;\r\n      image: string;\r\n    }>;\r\n  };\r\n}\r\n\r\nexport default function DesignSystemWebinars({ content }: DesignSystemWebinarsProps) {\r\n  return (\r\n    <section className=\"w-full py-16 lg:py-32 bg-background\">\r\n      <div className=\"container mx-auto px-4 md:px-6 lg:px-8 flex flex-col gap-12 text-center text-foreground\">\r\n        <header className=\"text-center py-8 lg:py-16\">\r\n          <h2 className=\"text-3xl md:text-4xl lg:text-5xl font-bold\">\r\n            {content.title}\r\n          </h2>\r\n        </header>\r\n        <div className=\"grid gap-8 sm:grid-cols-12 lg:gap-10\">\r\n          {content.webinars.map((webinar, index) => (\r\n            <a\r\n              key={index}\r\n              href={webinar.href}\r\n              className=\"group grid gap-y-4 sm:grid-cols-10 sm:gap-x-6 lg:gap-x-8 sm:col-span-12 bg-card border border-border rounded-lg hover:shadow-lg transition-all duration-300\"\r\n            >\r\n              <div className=\"sm:col-span-5 flex flex-col gap-4 justify-center p-6 text-start text-foreground\">\r\n                <div className=\"text-xs uppercase tracking-wider text-muted-foreground flex gap-4\">\r\n                  <span>{webinar.label}</span>\r\n                  <span>{webinar.author}</span>\r\n                </div>\r\n                <h3 className=\"text-xl md:text-2xl lg:text-3xl font-semibold\">\r\n                  {webinar.title}\r\n                </h3>\r\n                <p className=\"text-sm text-muted-foreground\">{webinar.summary}</p>\r\n                <div className=\"flex items-center gap-2 text-primary font-medium hover:underline\">\r\n                  <span>Read more</span>\r\n                  <ArrowRight className=\"w-4 h-4 transition-transform group-hover:translate-x-1\" />\r\n                </div>\r\n              </div>\r\n              <div className=\"sm:col-span-5\">\r\n                <div className=\"aspect-video overflow-hidden rounded-lg border border-border\">\r\n                  <img\r\n                    src={webinar.image}\r\n                    alt={webinar.title}\r\n                    width={560}\r\n                    height={315}\r\n                    className=\"object-cover w-full h-auto max-w-[560px] transition-transform group-hover:scale-105\"\r\n                  />\r\n                </div>\r\n              </div>\r\n            </a>\r\n          ))}\r\n        </div>\r\n      </div>\r\n    </section>\r\n  );\r\n}\r\n\r\nexport const designSystemWebinarsTemplate = {\r\n  id: \"businessDesignSystemWebinars\",\r\n  name: \"Design System Webinars\",\r\n  description: \"Display webinars related to the design system\",\r\n  component: DesignSystemWebinars,\r\n  defaultContent: {\r\n    title: \"Discover Our Design System\",\r\n    webinars: [\r\n      {\r\n        title: \"Introduction to Buildy/UI: A Modern Design System\",\r\n        summary: \"Learn how Buildy/UI empowers developers and designers to create efficient, accessible, and beautiful interfaces effortlessly.\",\r\n        label: \"UI/UX Insights\",\r\n        author: \"Alex Dev\",\r\n        published: \"10 Feb 2025\",\r\n        href: \"#\",\r\n        image: \"https://images.unsplash.com/photo-1542125387-c71274d94f0a?ixlib=rb-4.0.3&ixid=MnwxMjA3fDB8MHxwaG90by1wYWdlfHx8fGVufDB8fHx8&auto=format&fit=crop&w=560&h=315&q=80\"\r\n      },\r\n      {\r\n        title: \"Advanced Prototyping with Buildy/UI\",\r\n        summary: \"Explore advanced techniques for rapid prototyping and collaboration using our modular component library.\",\r\n        label: \"Prototyping Techniques\",\r\n        author: \"Jordan Smith\",\r\n        published: \"15 Feb 2025\",\r\n        href: \"#\",\r\n        image: \"https://images.unsplash.com/photo-1542125387-c71274d94f0a?ixlib=rb-4.0.3&ixid=MnwxMjA3fDB8MHxwaG90by1wYWdlfHx8fGVufDB8fHx8&auto=format&fit=crop&w=560&h=315&q=80\"\r\n      }\r\n    ]\r\n  }\r\n};",
      "target": "blocks"
    }
  ]
}