{
  "$schema": "https://buildy.tw/schema/registry-item.json",
  "name": "media",
  "type": "registry:component",
  "dependencies": [
    "react"
  ],
  "devDependencies": [],
  "files": [
    {
      "path": "packages/ui/src/components/media.tsx",
      "content": "import * as React from \"react\"\nimport { cn } from \"@/lib/utils\";\n\nfunction Img({ className, ...props }: React.ComponentProps<\"img\">) {\n  return (\n    <img\n      data-slot=\"img\"\n      className={cn(className)}\n      {...props}\n    />\n  )\n}\n\nImg.displayName = \"Img\"\n\nfunction Video({ className, ...props }: React.ComponentProps<\"video\">) {\n  return (\n    <video\n      data-slot=\"video\"\n      className={cn(className)}\n      {...props}\n    />\n  )\n}\n\nVideo.displayName = \"Video\"\n\nfunction Audio({ className, ...props }: React.ComponentProps<\"audio\">) {\n  return (\n    <audio\n      data-slot=\"audio\"\n      className={cn(className)}\n      {...props}\n    />\n  )\n}\n\nAudio.displayName = \"Audio\"\n\nfunction Picture({ className, ...props }: React.ComponentProps<\"picture\">) {\n  return (\n    <picture\n      data-slot=\"picture\"\n      className={cn(className)}\n      {...props}\n    />\n  )\n}\n\nPicture.displayName = \"Picture\"\n\nfunction Source({ className, ...props }: React.ComponentProps<\"source\">) {\n  return (\n    <source\n      data-slot=\"source\"\n      className={cn(className)}\n      {...props}\n    />\n  )\n}\n\nSource.displayName = \"Source\"\n\nfunction Iframe({ className, ...props }: React.ComponentProps<\"iframe\">) {\n  return (\n    <iframe\n      data-slot=\"iframe\"\n      className={cn(className)}\n      {...props}\n    />\n  )\n}\n\nIframe.displayName = \"Iframe\"\n\nfunction Map({ className, ...props }: React.ComponentProps<\"map\">) {\n  return (\n    <map\n      data-slot=\"map\"\n      className={cn(className)}\n      {...props}\n    />\n  )\n}\n\nMap.displayName = \"Map\"\n\nfunction Area({ className, ...props }: React.ComponentProps<\"area\">) {\n  return (\n    <area\n      data-slot=\"area\"\n      className={cn(className)}\n      {...props}\n    />\n  )\n}\n\nArea.displayName = \"Area\"\n\nfunction Object({ className, ...props }: React.ComponentProps<\"object\">) {\n  return (\n    <object\n      data-slot=\"object\"\n      className={cn(className)}\n      {...props}\n    />\n  )\n}\n\nObject.displayName = \"Object\"\n\nfunction Svg({ className, ...props }: React.ComponentProps<\"svg\">) {\n  return (\n    <svg\n      data-slot=\"svg\"\n      className={cn(className)}\n      {...props}\n    />\n  )\n}\n\nSvg.displayName = \"Svg\"\n\nfunction Canvas({ className, ...props }: React.ComponentProps<\"canvas\">) {\n  return (\n    <canvas\n      data-slot=\"canvas\"\n      className={cn(className)}\n      {...props}\n    />\n  )\n}\n\nCanvas.displayName = \"Canvas\"\n\nexport { Img, Video, Audio, Picture, Source, Iframe, Map, Area, Object, Svg, Canvas }",
      "target": "components"
    }
  ]
}