{
  "$schema": "https://buildy.tw/schema/registry-item.json",
  "name": "card",
  "type": "registry:ui",
  "dependencies": [
    "react"
  ],
  "devDependencies": [],
  "files": [
    {
      "path": "packages/ui/src/ui/card.tsx",
      "content": "import * as React from \"react\"\nimport { cn } from \"@/lib/utils\";\n\nfunction Card({ className, ...props }: React.ComponentProps<\"div\">) {\n  return (\n    <div\n      data-slot=\"card\"\n      className={cn(\n        \"bg-card text-card-foreground flex flex-col gap-6 rounded-md border shadow-sm\",\n        className\n      )}\n      {...props}\n    />\n  )\n}\n\nfunction CardHeader({ className, ...props }: React.ComponentProps<\"div\">) {\n  return (\n    <div\n      data-slot=\"card-header\"\n      className={cn(\n        \"@container/card-header grid-rows-[auto_auto] grid auto-rows-min items-start gap-1.5 mt-4 px-6 has-[data-slot=card-action]:grid-cols-[1fr_auto] [.border-b]:pb-6\",\n        className\n      )}\n      {...props}\n    />\n  )\n}\n\nfunction CardTitle({ className, ...props }: React.ComponentProps<\"h3\">) {\n  return (\n    <h3\n      data-slot=\"card-title\"\n      className={cn(\"leading-none font-bold text-xl mb-2\", className)}\n      {...props}\n    />\n  )\n}\n\nfunction CardDescription({ className, ...props }: React.ComponentProps<\"div\">) {\n  return (\n    <div\n      data-slot=\"card-description\"\n      className={cn(\"text-muted-foreground text-sm mb-4\", className)}\n      {...props}\n    />\n  )\n}\n\nfunction CardAction({ className, ...props }: React.ComponentProps<\"div\">) {\n  return (\n    <div\n      data-slot=\"card-action\"\n      className={cn(\n        \"col-start-2 row-span-2 row-start-1 self-start justify-self-end\",\n        className\n      )}\n      {...props}\n    />\n  )\n}\n\nfunction CardMeta({\n  className,\n  ...props\n}: React.ComponentProps<\"div\">) {\n  return (\n    <div\n      data-slot=\"article-meta\"\n      className={cn(\n        \"flex flex-wrap items-center gap-3 text-sm text-muted-foreground\",\n        className\n      )}\n      {...props}\n    />\n  );\n}\n\nfunction CardFigure({\n  className,\n  ...props\n}: React.ComponentProps<\"figure\">) {\n  return (\n    <figure\n      data-slot=\"article-figure\"\n      className={cn(\n        \"overflow-hidden\",\n        className\n      )}\n      {...props}\n    />\n  );\n}\n\nfunction CardImage({\n  className,\n  ...props\n}: React.ComponentProps<\"img\">) {\n  return (\n    <img\n      data-slot=\"article-image\"\n      className={cn(\n        \"aspect-video w-full object-cover rounded-t-md\",\n        className\n      )}\n      {...props}\n    />\n  );\n}\n\nfunction CardFigcaption({\n  className,\n  ...props\n}: React.ComponentProps<\"figcaption\">) {\n  return (\n    <figcaption\n      data-slot=\"article-figcaption\"\n      className={cn(\n        \"mt-2 text-center text-sm text-muted-foreground\",\n        className\n      )}\n      {...props}\n    />\n  );\n}\n\nfunction CardContent({ className, ...props }: React.ComponentProps<\"div\">) {\n  return (\n    <div\n      data-slot=\"card-content\"\n      className={cn(\"px-6 py-4\", className)}\n      {...props}\n    />\n  )\n}\n\nfunction CardFooter({ className, ...props }: React.ComponentProps<\"div\">) {\n  return (\n    <div\n      data-slot=\"card-footer\"\n      className={cn(\"flex items-center px-6 [.border-t]:pt-6\", className)}\n      {...props}\n    />\n  )\n}\n\nexport {\n  Card,\n  CardHeader,\n  CardFooter,\n  CardTitle,\n  CardAction,\n  CardDescription,\n  CardMeta,\n  CardFigure,\n  CardImage,\n  CardFigcaption,\n  CardContent,\n}\n",
      "target": "ui"
    }
  ]
}