{
  "$schema": "https://buildy.tw/schema/registry-item.json",
  "name": "textarea",
  "type": "registry:ui",
  "dependencies": [
    "react"
  ],
  "devDependencies": [],
  "files": [
    {
      "path": "packages/ui/src/ui/textarea.tsx",
      "content": "import * as React from \"react\"\n\nimport { cn } from \"@/lib/utils\"\n\nfunction Textarea({ className, ...props }: React.ComponentProps<\"textarea\">) {\n  return (\n    <textarea\n      data-slot=\"textarea\"\n      className={cn(\n        \"border-input placeholder:text-muted-foreground focus-visible:border-ring focus-visible:ring-ring/50 aria-invalid:ring-destructive/20 dark:aria-invalid:ring-destructive/40 aria-invalid:border-destructive dark:bg-input/30 flex field-sizing-content min-h-16 w-full rounded-md border bg-transparent px-3 py-2 text-base shadow-xs transition-[color,box-shadow] outline-none focus-visible:ring-[3px] disabled:cursor-not-allowed disabled:opacity-50 md:text-sm\",\n        className\n      )}\n      {...props}\n    />\n  )\n}\n\nexport { Textarea }",
      "target": "ui"
    }
  ]
}