{
  "$schema": "https://buildy.tw/schema/registry-item.json",
  "name": "breadcrumb",
  "type": "registry:ui",
  "dependencies": [
    "react",
    "@radix-ui/react-slot",
    "lucide-react"
  ],
  "devDependencies": [],
  "files": [
    {
      "path": "packages/ui/src/ui/breadcrumb.tsx",
      "content": "import * as React from \"react\"\nimport { Slot } from \"@radix-ui/react-slot\"\nimport { ChevronRight, MoreHorizontal } from \"lucide-react\"\n\nimport { cn } from \"@/lib/utils\"\n\nfunction Breadcrumb({ ...props }: React.ComponentProps<\"nav\">) {\n  return <nav aria-label=\"breadcrumb\" data-slot=\"breadcrumb\" {...props} />\n}\n\nfunction BreadcrumbList({ className, ...props }: React.ComponentProps<\"ol\">) {\n  return (\n    <ol\n      data-slot=\"breadcrumb-list\"\n      className={cn(\n        \"text-muted-foreground flex flex-wrap items-center gap-1.5 text-sm break-words sm:gap-2.5\",\n        className\n      )}\n      {...props}\n    />\n  )\n}\n\nfunction BreadcrumbItem({ className, ...props }: React.ComponentProps<\"li\">) {\n  return (\n    <li\n      data-slot=\"breadcrumb-item\"\n      className={cn(\"inline-flex items-center gap-1.5\", className)}\n      {...props}\n    />\n  )\n}\n\nfunction BreadcrumbLink({\n  asChild,\n  className,\n  ...props\n}: React.ComponentProps<\"a\"> & {\n  asChild?: boolean\n}) {\n  const Comp = asChild ? Slot : \"a\"\n\n  return (\n    <Comp\n      data-slot=\"breadcrumb-link\"\n      className={cn(\"hover:text-foreground transition-colors\", className)}\n      {...props}\n    />\n  )\n}\n\nfunction BreadcrumbPage({ className, ...props }: React.ComponentProps<\"span\">) {\n  return (\n    <span\n      data-slot=\"breadcrumb-page\"\n      role=\"link\"\n      aria-disabled=\"true\"\n      aria-current=\"page\"\n      className={cn(\"text-foreground font-normal\", className)}\n      {...props}\n    />\n  )\n}\n\nfunction BreadcrumbSeparator({\n  children,\n  className,\n  ...props\n}: React.ComponentProps<\"li\">) {\n  return (\n    <li\n      data-slot=\"breadcrumb-separator\"\n      role=\"presentation\"\n      aria-hidden=\"true\"\n      className={cn(\"[&>svg]:size-3.5\", className)}\n      {...props}\n    >\n      {children ?? <ChevronRight />}\n    </li>\n  )\n}\n\nfunction BreadcrumbEllipsis({\n  className,\n  ...props\n}: React.ComponentProps<\"span\">) {\n  return (\n    <span\n      data-slot=\"breadcrumb-ellipsis\"\n      role=\"presentation\"\n      aria-hidden=\"true\"\n      className={cn(\"flex size-9 items-center justify-center\", className)}\n      {...props}\n    >\n      <MoreHorizontal className=\"size-4\" />\n      <span className=\"sr-only\">More</span>\n    </span>\n  )\n}\n\nexport {\n  Breadcrumb,\n  BreadcrumbList,\n  BreadcrumbItem,\n  BreadcrumbLink,\n  BreadcrumbPage,\n  BreadcrumbSeparator,\n  BreadcrumbEllipsis,\n}",
      "target": "ui"
    }
  ]
}