{
  "$schema": "https://buildy.tw/schema/registry-item.json",
  "name": "aside",
  "type": "registry:component",
  "dependencies": [
    "react"
  ],
  "devDependencies": [],
  "files": [
    {
      "path": "packages/ui/src/components/aside.tsx",
      "content": "import * as React from \"react\"\nimport { cn } from \"@/lib/utils\";\n\nfunction Aside({ className, ...props }: React.ComponentProps<\"aside\">) {\n  return (\n    <aside\n      data-slot=\"aside\"\n      className={cn(className)}\n      {...props}\n    />\n  )\n}\n\nAside.displayName = \"Aside\"\n\nexport { Aside }",
      "target": "components"
    }
  ]
}