{
  "$schema": "https://buildy.tw/schema/registry-item.json",
  "name": "FeaturesSplitCarousel",
  "type": "registry:block",
  "description": "",
  "dependencies": [],
  "devDependencies": [],
  "files": [
    {
      "path": "builddy/blocks/features/FeaturesSplitCarousel.tsx",
      "content": "import { Badge } from \"@/components/ui/badge\";\r\nimport {\r\n  Carousel,\r\n  CarouselContent,\r\n  CarouselItem,\r\n  CarouselNext,\r\n  CarouselPrevious,\r\n} from \"@/components/ui/carousel\";\r\n\r\ninterface FeaturesSplitCarouselProps {\r\n  content: {\r\n    badge: string;\r\n    title: string;\r\n    description: string;\r\n    carouselItems: Array<{\r\n      id: string;\r\n      label: string;\r\n    }>;\r\n  };\r\n}\r\n\r\nexport default function FeaturesSplitCarousel({ content }: FeaturesSplitCarouselProps) {\r\n  const { badge, title, description, carouselItems } = content;\r\n  return (\r\n    <section className=\"w-full py-16 lg:py-32 bg-background\">\r\n      <div className=\"container mx-auto px-4 md:px-6 lg:px-8\">\r\n        <div className=\"grid grid-cols-1 gap-10 items-end lg:grid-cols-2\">\r\n          <header className=\"flex flex-col gap-4 items-start\">\r\n            <Badge variant=\"outline\" className=\"text-muted-foreground rounded-full h-7\">\r\n              {badge}\r\n            </Badge>\r\n            <div className=\"flex flex-col gap-2\">\r\n              <h2 className=\"text-3xl md:text-4xl lg:text-6xl font-bold max-w-xl text-foreground\">\r\n                {title}\r\n              </h2>\r\n              <p className=\"text-lg text-muted-foreground max-w-2xl\">\r\n                {description}\r\n              </p>\r\n            </div>\r\n          </header>\r\n          <div className=\"w-full max-w-full px-4 md:px-6 lg:px-8\">\r\n            <Carousel opts={{ align: \"start\", loop: true }}>\r\n              <CarouselContent>\r\n                {carouselItems?.map((item) => (\r\n                  <CarouselItem key={item.id}>\r\n                    <div className=\"flex rounded aspect-video bg-muted items-center justify-center\">\r\n                      <span className=\"text-sm text-muted-foreground\">{item.label}</span>\r\n                    </div>\r\n                  </CarouselItem>\r\n                ))}\r\n              </CarouselContent>\r\n              <CarouselPrevious />\r\n              <CarouselNext />\r\n            </Carousel>\r\n          </div>\r\n        </div>\r\n      </div>\r\n    </section>\r\n  );\r\n}\r\n\r\nexport const featuresSplitCarouselTemplate = {\r\n  id: \"featuresSplitCarousel\",\r\n  name: \"Features Split Carousel\",\r\n  description: \"A split section with a carousel for features\",\r\n  component: FeaturesSplitCarousel,\r\n  defaultContent: {\r\n    badge: \"Design System\",\r\n    title: \"Discover Endless Possibilities with Buildy/UI\",\r\n    description: \"Empower your projects with versatile and innovative solutions.\",\r\n    carouselItems: [\r\n      { id: \"item1\", label: \"Possibilities with Buildy/UI\" },\r\n      { id: \"item2\", label: \"Shadcn Library Integration\" },\r\n      { id: \"item3\", label: \"User-friendly UI/UX\" }\r\n    ]\r\n  }\r\n};",
      "target": "blocks"
    }
  ]
}