{
  "$schema": "https://buildy.tw/schema/registry-item.json",
  "name": "skeleton",
  "type": "registry:ui",
  "description": "",
  "dependencies": [],
  "devDependencies": [],
  "files": [
    {
      "path": "semantic/ui/skeleton.tsx",
      "content": "import { cn } from \"@/lib/utils\";\n\nfunction Skeleton({ className, ...props }: React.ComponentProps<\"div\">) {\n  return (\n    <div\n\n      className={cn(\"bg-accent animate-pulse rounded-md\", className)}\n      {...props} />);\n\n\n}\n\nexport { Skeleton };",
      "target": "ui"
    }
  ]
}